{
  "schema_version": "1.0",
  "id": "SYN-NARROWED-GATE-SCOPE-CLEAN",
  "title": "Complete validation gate scope clean control",
  "category": "synthetic_structural",
  "label": "VERIFIED_SAFE",
  "critical": false,
  "expected_decision": "MERGE",
  "fixture_path": "fixtures/synthetic/gate_scope/clean",
  "detectors": ["gate_scope"],
  "required_evidence": ["gate_scope"]
}
